pod=rook-ceph.rbd.csi.ceph.com-nodeplugin-x445z
attempts=5 all failed
capture_node=pve4 (192.168.11.4)
filter=host 10.31.1.2 and host 192.168.10.4 and port 3300

16:33:15.884319 IP 10.31.1.2.37388 > 192.168.10.4.3300: Flags [S]
16:33:15.884331 IP 192.168.10.4.3300 > 10.31.1.2.37388: Flags [R.]
16:33:17.047337 IP 10.31.1.2.37396 > 192.168.10.4.3300: Flags [S]
16:33:17.047359 IP 192.168.10.4.3300 > 10.31.1.2.37396: Flags [R.]
16:33:18.253033 IP 10.31.1.2.37412 > 192.168.10.4.3300: Flags [S]
16:33:18.253048 IP 192.168.10.4.3300 > 10.31.1.2.37412: Flags [R.]
16:33:19.430613 IP 10.31.1.2.37420 > 192.168.10.4.3300: Flags [S]
16:33:19.430626 IP 192.168.10.4.3300 > 10.31.1.2.37420: Flags [R.]
16:33:20.611782 IP 10.31.1.2.37424 > 192.168.10.4.3300: Flags [S]
16:33:20.611802 IP 192.168.10.4.3300 > 10.31.1.2.37424: Flags [R.]

interpretation=packets reach pve4; host actively resets TCP/3300 on mon4 endpoint from worker-1 source.
