pod=rook-ceph.rbd.csi.ceph.com-nodeplugin-xg8gx
attempts=5 all failed
capture_node=pve5 (192.168.11.5)
filter=host 10.31.2.2 and host 192.168.10.5 and port 3300

16:41:23.238121 IP 10.31.2.2.47390 > 192.168.10.5.3300: Flags [S]
16:41:23.238151 IP 192.168.10.5.3300 > 10.31.2.2.47390: Flags [R.]
16:41:24.397565 IP 10.31.2.2.47406 > 192.168.10.5.3300: Flags [S]
16:41:24.397588 IP 192.168.10.5.3300 > 10.31.2.2.47406: Flags [R.]
16:41:25.554553 IP 10.31.2.2.47420 > 192.168.10.5.3300: Flags [S]
16:41:25.554564 IP 192.168.10.5.3300 > 10.31.2.2.47420: Flags [R.]
16:41:26.704502 IP 10.31.2.2.47432 > 192.168.10.5.3300: Flags [S]
16:41:26.704521 IP 192.168.10.5.3300 > 10.31.2.2.47432: Flags [R.]
16:41:27.858530 IP 10.31.2.2.55498 > 192.168.10.5.3300: Flags [S]
16:41:27.858544 IP 192.168.10.5.3300 > 10.31.2.2.55498: Flags [R.]

interpretation=second host reproduces same local-worker to local-mon reset behavior.
